<?xml version="1.0" encoding="utf-8"?>

<root xmlns:xs="http://www.w3.org/2001/XMLSchema-instance" xs:noNamespaceSchemaLocation="wargame_schema.xsd">

	<resources>

		<resource name="Energy">
			<amount type="INFINITE" />
			<position type="EVERYWHERE" />
		</resource>

		<resource name="Green Crystal">
			<amount type="FINITE" value="20000.0" />
			<position type="EXACT" x="85.0" z="75.0" />
			<size type="BOX" x="2.0" z="2.0" />
			<mesh name="green_crystal.mesh" x="1.0" y="1.0" z="1.0" />
		</resource>

		<resource name="Green Crystal">
			<amount type="FINITE" value="50000.0" />
			<position type="EXACT" x="55.0" z="78.0" />
			<size type="BOX" x="52.0" z="4.0" />
			<mesh name="green_crystal.mesh" material="green_crystal" x="2.0" y="2.0" z="2.0" />
		</resource>

		<resource name="Red Crystal">
			<amount type="RESTORE" speed="5.0" value="1000.0" />
			<position type="EXACT" x="25.0" z="78.0" />
			<size type="CIRCLE" radius="5.0" />
			<mesh name="red_crystal.mesh" material="red_crystal" x="1.2" y="1.2" z="1.2" />
		</resource>

		<resource name="Iron Ore">
			<amount type="FINITE" value="10500.0" />
			<position type="EXACT" x="85.0" y="10.0" z="75.0" />
			<size type="CIRCLE" radius="50.0" />
			<mesh name="iron_ore.mesh" x="1.0" y="1.0" z="1.0" />
		</resource>

		<resource name="Metal" />

		<resource name="Oil">
			<amount type="RESTORE" speed="0.5" value="500.0" />
			<position type="EXACT" x="85.0" y="10.0" z="75.0" />
			<size type="CIRCLE" radius="50.0" />
			<mesh name="oil.mesh" x="1.0" y="1.0" z="1.0" />
		</resource>

		<resource name="Fuel" />

	</resources>

</root>